{
  "schema_version": "fabricctl.installation-plan/v1",
  "status": "pass",
  "readiness": "unverified",
  "operation": {"network": false, "mutating": false},
  "deployment_obligations": {
    "assurance_level": "A3",
    "integration": {"mode": "gateway", "artifact": "Fabric Gateway"},
    "roles": [
      {"id": "deployment.role.connect", "plane": "connect", "artifact": "Fabric Gateway", "purpose": "Integrate the agent and propagate stable Fabric identity"},
      {"id": "deployment.role.control", "plane": "control", "artifact": "Fabric Control integration", "purpose": "Enforce only the referenced runtime control profile and bindings"},
      {"id": "deployment.role.collector", "plane": "observe", "artifact": "Fabric Collector", "purpose": "Receive, normalize, privacy-process, correlate, and route telemetry"},
      {"id": "deployment.role.relay", "plane": "observe", "artifact": "Fabric Relay", "purpose": "Durably export approved telemetry to the referenced destination"},
      {"id": "deployment.role.assurance_runner", "plane": "assurance", "artifact": "Fabric Assurance Runner", "purpose": "Run the referenced assurance plan outside the agent request path"}
    ],
    "references": [
      {"id": "deployment.reference.tenant_identity", "field": "spec.connection.tenantIdFrom", "reference": "tenant-identity"},
      {"id": "deployment.reference.workload_identity", "field": "spec.connection.workloadIdentityRef", "reference": "payments-spiffe-binding-v2"},
      {"id": "deployment.reference.control_profile", "field": "spec.controls.profileRef", "reference": "payments-agent-controls-v4"},
      {"id": "deployment.reference.relay", "field": "spec.observe.relayRef", "reference": "regulated-relay-eu-west"},
      {"id": "deployment.reference.assurance_plan", "field": "spec.assurance.planRef", "reference": "payments-release-gate-v7"},
      {"id": "deployment.reference.rollout_approval", "field": "spec.rollout.approvalRef", "reference": "change-1842"}
    ],
    "prerequisites": [
      {"id": "deployment.prerequisite.workload_identity_bound", "status": "required", "summary": "Bind and authorize the referenced workload identity independently of telemetry"},
      {"id": "deployment.prerequisite.rollout_approval_verified", "status": "required", "summary": "Independently verify the referenced approval before any rollout"},
      {"id": "deployment.prerequisite.a3.separation_of_duties", "status": "required", "summary": "Establish separation of duties for policy, approval, operation, and investigation"},
      {"id": "deployment.prerequisite.a3.recovery_evidence", "status": "required", "summary": "Test recovery and retain reconstruction evidence in a customer-approved destination"}
    ]
  },
  "deployment": {
    "name": "payments-agent-prod",
    "digest": "sha256:3333333333333333333333333333333333333333333333333333333333333333"
  },
  "target": {
    "name": "payments-agent-eu-target",
    "digest": "sha256:6666666666666666666666666666666666666666666666666666666666666666"
  },
  "distribution": {
    "artifactRef": "oci://registry.example.com/singleaxis/fabric",
    "version": "1.2.3",
    "digest": "sha256:4444444444444444444444444444444444444444444444444444444444444444"
  },
  "profile": {
    "name": "eu-ai-act-high-risk",
    "digest": "sha256:5555555555555555555555555555555555555555555555555555555555555555"
  },
  "backend": {
    "type": "helm",
    "helm": {
      "context": "eu-production",
      "namespace": "singleaxis-fabric",
      "releaseName": "payments-fabric",
      "createNamespace": false
    }
  },
  "actions": [
    {"order": 1, "id": "validate-contracts", "type": "validate", "target": "offline-bundle"},
    {"order": 2, "id": "render-helm-values", "type": "render", "target": "fabric-values.yaml"},
    {"order": 3, "id": "verify-digests", "type": "verify", "target": "bundle-manifest.json"}
  ],
  "prerequisites": [
    {
      "order": 1,
      "id": "target-identity",
      "status": "required",
      "description": "Confirm the declared Kubernetes context before any mutating command."
    }
  ]
}
